{
  "observation_id": "obs_000003",
  "screen_id": "screen_000003",
  "timestamp": "2026-09-18T00:31:00+05:30",
  "package_name": "com.example.app",
  "activity": "com.example.app.HomeActivity",
  "screenshot_path": "screenshots/obs_000003.png",
  "ui_tree_path": "ui_trees/obs_000003.xml",
  "elements": [
    {
      "element_id": "element_000008",
      "type": "android.widget.TextView",
      "text": "Welcome to Home",
      "content_description": null,
      "resource_id": "com.example:id/home_title",
      "clickable": false,
      "enabled": true,
      "scrollable": false,
      "bounds": {
        "left": 100,
        "top": 100,
        "right": 500,
        "bottom": 170
      }
    },
    {
      "element_id": "element_000009",
      "type": "android.widget.Button",
      "text": "Profile",
      "content_description": "Profile",
      "resource_id": "com.example:id/profile",
      "clickable": true,
      "enabled": true,
      "scrollable": false,
      "bounds": {
        "left": 100,
        "top": 250,
        "right": 500,
        "bottom": 330
      }
    },
    {
      "element_id": "element_000010",
      "type": "android.widget.Button",
      "text": "Settings",
      "content_description": "Settings",
      "resource_id": "com.example:id/settings",
      "clickable": true,
      "enabled": true,
      "scrollable": false,
      "bounds": {
        "left": 100,
        "top": 350,
        "right": 500,
        "bottom": 430
      }
    }
  ]
}